AssetID,Name,Description,Category,Location,Criticality,Status,Manufacturer,Model,SerialNumber,InstallDate,LastMaintenance,Department,Responsible
P-104,Pump Station 104,Main water distribution pump for Riverside district. Primary pump delivering 5000 GPM at 150 PSI. Critical asset for district water supply with redundant backup systems.,PUMP,Riverside Bridge Station,CRITICAL,OPERATIONAL,FlowTech Industries,FT-5000,FT5K-2018-0104,2018-03-15,2024-11-20,Water Operations,John Martinez
V-201,Valve Assembly 201,Main pressure regulation valve for north sector. Motorized butterfly valve with actuator. Controls pressure differential between transmission and distribution systems.,VALVE,North Plant,MEDIUM,OPERATIONAL,ValveTech Solutions,VTS-24-BF,VTS24-2019-0201,2019-08-12,2024-10-30,Water Distribution,David Lee
G-301,Generator G301,Emergency standby generator for South Treatment Plant. Diesel-powered 500kW unit provides backup power during utility outages. Automatic transfer switch with 10-second startup.,GENERATOR,South Treatment Plant,CRITICAL,OPERATIONAL,PowerGen Systems,PGS-500D,PGS500-2020-0301,2020-01-10,2024-12-01,Facilities,Tom Anderson
T-401,Storage Tank 401,Primary elevated water storage tank serving east distribution zone. 1 million gallon capacity. Steel construction with interior epoxy coating. Provides emergency storage and pressure stabilization.,TANK,East Reservoir Site,CRITICAL,OPERATIONAL,TankCraft Industries,TC-1000K-ELEVATED,TCEL-2015-0401,2015-09-01,2024-06-15,Water Operations,Lisa Williams
S-601,Flow Sensor Array 601,Ultrasonic flow meter array at Treatment Facility influent. Non-invasive clamp-on sensors measuring incoming flow. Provides critical data for treatment process control and billing.,SENSOR,Treatment Facility Influent,HIGH,OPERATIONAL,FlowMetrics Systems,FM-ULTRA-24,FMUL-2020-0601,2020-02-10,2024-11-01,Instrumentation,Emily Chang
